{
  "manifestVersion": 1,
  "contentVersion": "0.1.0",
  "tileSize": 32,
  "canvas": {
    "w": 640,
    "h": 360
  },
  "scales": [
    2,
    3,
    4,
    6
  ],
  "assetRoot": "game/assets/",
  "palette": "manifest/greybox_palette.json",
  "visibilityTiers": {
    "1": "on the build screen every round",
    "2": "on the battle or autopsy screen every fight",
    "3": "seen most runs: map, codex, rarer content",
    "4": "seen rarely: B1, rituals, bosses, debug"
  },
  "entries": [
    {
      "id": "emp.intern",
      "kind": "employee",
      "category": "people",
      "label": "Intern",
      "footprint": {
        "w": 1,
        "h": 1
      },
      "sprite": {
        "w": 32,
        "h": 32,
        "anchor": {
          "x": 0.5,
          "y": 1.0
        },
        "asset": "game/assets/topdown/emp/intern.png",
        "sourceRect": null,
        "frames": {
          "idleDown": [
            0,
            0
          ]
        }
      },
      "sortBias": 0,
      "perspective": "topdown",
      "screens": [
        "build",
        "shop",
        "battle.inset",
        "autopsy"
      ],
      "visibility": 1,
      "reads": "A engineering at a glance; department must be readable from silhouette or uniform colour",
      "candidateSource": "characterpack/Blackoutlinecharacters/MaleYouth/Idle frame 1 (facing down)",
      "verify": false,
      "releaseGate": true,
      "overhang": {
        "left": 0,
        "top": 0,
        "right": 0,
        "bottom": 0
      }
    },
    {
      "id": "emp.junior_dev",
      "kind": "employee",
      "category": "people",
      "label": "Junior Developer",
      "footprint": {
        "w": 1,
        "h": 1
      },
      "sprite": {
        "w": 32,
        "h": 32,
        "anchor": {
          "x": 0.5,
          "y": 1.0
        },
        "asset": "game/assets/topdown/emp/junior_dev.png",
        "sourceRect": null,
        "frames": {
          "idleDown": [
            0,
            0
          ]
        }
      },
      "sortBias": 0,
      "perspective": "topdown",
      "screens": [
        "build",
        "shop",
        "battle.inset",
        "autopsy"
      ],
      "visibility": 1,
      "reads": "A engineering at a glance; department must be readable from silhouette or uniform colour",
      "candidateSource": "characterpack/Blackoutlinecharacters/MaleStudent1/Idle frame 1 (facing down)",
      "verify": false,
      "releaseGate": true,
      "overhang": {
        "left": 0,
        "top": 0,
        "right": 0,
        "bottom": 0
      }
    },
    {
      "id": "emp.qa_tester",
      "kind": "employee",
      "category": "people",
      "label": "QA Tester",
      "footprint": {
        "w": 1,
        "h": 1
      },
      "sprite": {
        "w": 32,
        "h": 32,
        "anchor": {
          "x": 0.5,
          "y": 1.0
        },
        "asset": "game/assets/topdown/emp/qa_tester.png",
        "sourceRect": null,
        "frames": {
          "idleDown": [
            0,
            0
          ]
        }
      },
      "sortBias": 0,
      "perspective": "topdown",
      "screens": [
        "build",
        "shop",
        "battle.inset",
        "autopsy"
      ],
      "visibility": 1,
      "reads": "A engineering at a glance; department must be readable from silhouette or uniform colour",
      "candidateSource": "characterpack/Blackoutlinecharacters/FemaleStudent/Idle frame 1 (facing down)",
      "verify": false,
      "releaseGate": true,
      "overhang": {
        "left": 0,
        "top": 0,
        "right": 0,
        "bottom": 0
      }
    },
    {
      "id": "emp.senior_dev",
      "kind": "employee",
      "category": "people",
      "label": "Senior Developer",
      "footprint": {
        "w": 1,
        "h": 1
      },
      "sprite": {
        "w": 32,
        "h": 32,
        "anchor": {
          "x": 0.5,
          "y": 1.0
        },
        "asset": "game/assets/topdown/emp/senior_dev.png",
        "sourceRect": null,
        "frames": {
          "idleDown": [
            0,
            0
          ]
        }
      },
      "sortBias": 0,
      "perspective": "topdown",
      "screens": [
        "build",
        "shop",
        "battle.inset",
        "autopsy"
      ],
      "visibility": 2,
      "reads": "A engineering at a glance; department must be readable from silhouette or uniform colour",
      "candidateSource": "characterpack/Blackoutlinecharacters/MaleBusinessMan/Idle frame 1 (facing down)",
      "verify": false,
      "releaseGate": true,
      "overhang": {
        "left": 0,
        "top": 0,
        "right": 0,
        "bottom": 0
      }
    },
    {
      "id": "emp.devops",
      "kind": "employee",
      "category": "people",
      "label": "DevOps",
      "footprint": {
        "w": 1,
        "h": 1
      },
      "sprite": {
        "w": 32,
        "h": 32,
        "anchor": {
          "x": 0.5,
          "y": 1.0
        },
        "asset": "game/assets/topdown/emp/devops.png",
        "sourceRect": null,
        "frames": {
          "idleDown": [
            0,
            0
          ]
        }
      },
      "sortBias": 0,
      "perspective": "topdown",
      "screens": [
        "build",
        "shop",
        "battle.inset",
        "autopsy"
      ],
      "visibility": 2,
      "reads": "A engineering at a glance; department must be readable from silhouette or uniform colour",
      "candidateSource": "characterpack/Blackoutlinecharacters/MalePunk/Idle frame 1 (facing down)",
      "verify": false,
      "releaseGate": true,
      "overhang": {
        "left": 0,
        "top": 0,
        "right": 0,
        "bottom": 0
      }
    },
    {
      "id": "emp.sysadmin",
      "kind": "employee",
      "category": "people",
      "label": "Sysadmin",
      "footprint": {
        "w": 1,
        "h": 1
      },
      "sprite": {
        "w": 32,
        "h": 32,
        "anchor": {
          "x": 0.5,
          "y": 1.0
        },
        "asset": "game/assets/topdown/emp/sysadmin.png",
        "sourceRect": null,
        "frames": {
          "idleDown": [
            0,
            0
          ]
        }
      },
      "sortBias": 0,
      "perspective": "topdown",
      "screens": [
        "build",
        "shop",
        "battle.inset",
        "autopsy"
      ],
      "visibility": 2,
      "reads": "A engineering at a glance; department must be readable from silhouette or uniform colour",
      "candidateSource": "characterpack/Blackoutlinecharacters/MaleCasual/Idle frame 1 (facing down)",
      "verify": false,
      "releaseGate": true,
      "overhang": {
        "left": 0,
        "top": 0,
        "right": 0,
        "bottom": 0
      }
    },
    {
      "id": "emp.architect",
      "kind": "employee",
      "category": "people",
      "label": "Architect",
      "footprint": {
        "w": 1,
        "h": 1
      },
      "sprite": {
        "w": 32,
        "h": 32,
        "anchor": {
          "x": 0.5,
          "y": 1.0
        },
        "asset": "game/assets/topdown/emp/architect.png",
        "sourceRect": null,
        "frames": {
          "idleDown": [
            0,
            0
          ]
        }
      },
      "sortBias": 0,
      "perspective": "topdown",
      "screens": [
        "build",
        "shop",
        "battle.inset",
        "autopsy"
      ],
      "visibility": 2,
      "reads": "A engineering at a glance; department must be readable from silhouette or uniform colour",
      "candidateSource": "characterpack/Blackoutlinecharacters/MaleBusinessManOld/Idle frame 1 (facing down)",
      "verify": false,
      "releaseGate": true,
      "overhang": {
        "left": 0,
        "top": 0,
        "right": 0,
        "bottom": 0
      }
    },
    {
      "id": "emp.cto",
      "kind": "employee",
      "category": "people",
      "label": "CTO",
      "footprint": {
        "w": 1,
        "h": 1
      },
      "sprite": {
        "w": 32,
        "h": 32,
        "anchor": {
          "x": 0.5,
          "y": 1.0
        },
        "asset": "game/assets/topdown/emp/cto.png",
        "sourceRect": null,
        "frames": {
          "idleDown": [
            0,
            0
          ]
        }
      },
      "sortBias": 0,
      "perspective": "topdown",
      "screens": [
        "build",
        "shop",
        "battle.inset",
        "autopsy"
      ],
      "visibility": 2,
      "reads": "A engineering at a glance; department must be readable from silhouette or uniform colour",
      "candidateSource": "characterpack/Blackoutlinecharacters/MaleTraditional/Idle frame 1 (facing down)",
      "verify": false,
      "releaseGate": true,
      "overhang": {
        "left": 0,
        "top": 0,
        "right": 0,
        "bottom": 0
      }
    },
    {
      "id": "emp.paralegal",
      "kind": "employee",
      "category": "people",
      "label": "Paralegal",
      "footprint": {
        "w": 1,
        "h": 1
      },
      "sprite": {
        "w": 32,
        "h": 32,
        "anchor": {
          "x": 0.5,
          "y": 1.0
        },
        "asset": "game/assets/topdown/emp/paralegal.png",
        "sourceRect": null,
        "frames": {
          "idleDown": [
            0,
            0
          ]
        }
      },
      "sortBias": 0,
      "perspective": "topdown",
      "screens": [
        "build",
        "shop",
        "battle.inset",
        "autopsy"
      ],
      "visibility": 1,
      "reads": "A legal at a glance; department must be readable from silhouette or uniform colour",
      "candidateSource": "characterpack/Blackoutlinecharacters/FemaleTrendy/Idle frame 1 (facing down)",
      "verify": false,
      "releaseGate": true,
      "overhang": {
        "left": 0,
        "top": 0,
        "right": 0,
        "bottom": 0
      }
    },
    {
      "id": "emp.compliance_officer",
      "kind": "employee",
      "category": "people",
      "label": "Compliance Officer",